created_at,query,statuses_count,followers_count,friends_count,user_location,full_text,cleaned,class
Thu Feb 17 03:54:52 +0000 2022,joe biden,2711,189,524,Usa,Why have so many of you forgotten?  Why?  Joe has been in office for one year and so many Dems are ready to boot him?? He is blocked at every turn by republicans who apparently trust Putin in higher numbers than President Biden? Vote BLUE for Senate! We must be the majority! https://t.co/AtLKj6L9pu,many forgotten joe office one year many dems ready boot blocked every turn republican apparently trust putin higher number president biden vote blue senate must majority,1
Thu Feb 17 03:52:31 +0000 2022,joe biden,52204,74761,1646,Usa,"President Biden says he will do everything in his power to “provide relief” should the Russia-Ukraine conflict disrupt the supply of oil and gas in the U.S., but what can he do? The Fact Check Team's @JanaeBowens and @JohnSewardDC looked into his options: https://t.co/30OyQb9Unf https://t.co/hH3pIfdMkf",president biden say everything power provide relief conflict disrupt supply oil gas fact check team looked option,1
Thu Feb 17 03:52:04 +0000 2022,joe biden,3787,1461,455,Usa,"When’s ‘our upcoming invasions, I’d like to plan my vacation’: Diplomat mocks US-UK media

According to the Politico newspaper, US President Joe Biden claimed that Russia could allegedly attack Ukraine on February 16
https://t.co/qdnTla7mjD",upcoming invasion like plan vacation diplomat mock medium according politico newspaper president claimed russia could allegedly attack february,-1
Thu Feb 17 03:49:36 +0000 2022,joe biden,52204,74761,1646,Usa,"As the world waits on Russia's next move, President Joe Biden is warning that an invasion of Ukraine would have a direct impact on energy prices in the U.S., which is already contributing to the highest inflation in 40 years.

STORY: https://t.co/kpNyMVE5ZC https://t.co/6Z6Qkah9iz",world wait russia next move president warning invasion would direct impact energy price already contributing highest inflation year story,-1
Thu Feb 17 04:11:27 +0000 2022,joe biden,358,9,475,Usa,"Ukraine: Joe Biden urges Putin to 'step back from brink of war' as he sends message of peace to Russians
https://t.co/gLT4nf8yqH

#USA #CA #UK #AUS #NZ https://t.co/hyWW0Rm2q1",urge putin back brink war sends message peace russian,-1
Thu Feb 17 04:07:19 +0000 2022,joe biden,329503,723324,244,Australia,"US President Joe Biden is ordering the release of Trump White House visitor logs to the House committee investigating the riot of January 6, 2021. #9News https://t.co/vEgpKPf6iY",president ordering release trump white house visitor log house committee investigating riot january,-1
Thu Feb 17 04:06:20 +0000 2022,joe biden,36271,1490,665,Usa,Opinion | Is Sleepy Joe Biden Making Vladimir Putin Blink? - The New York Times https://t.co/iKEljaPFvN via @GoogleNews,opinion sleepy making vladimir putin blink new york time via,0
Thu Feb 17 04:06:07 +0000 2022,joe biden,253,668,39,Usa,"You could call President Joe Biden a sweetheart of a guy. A true romantic.
Leading any other president in mass shootings (and #Covid deaths), there were no mass shootings in #USA on Valentine's Day in Joe Biden's America https://t.co/dZlX2p1fYD",could call president sweetheart guy true romantic leading president mass shooting death mass shooting valentine day america,1
Thu Feb 17 04:30:25 +0000 2022,joe biden,27551,186,260,Usa,@JoeBiden @StephenKing President Biden you need to get other at least two Republican Senators on your side because Joe and Sinema will never agree on build back better even the Supreme Court Justice so forget about bipartisanship because if you don't you'll be a one-term president like #AgentOrange,president biden need get least two republican sers side joe sinema never agree build back better even supreme court justice forget bipartisanship president like,1
Thu Feb 17 04:30:06 +0000 2022,joe biden,44493,7737,59,Usa,"WASHINGTON (AP) — President Joe Biden is ordering the release of Trump White House visitor logs to the House committee investigating the riot of Jan. 6, 2021, once more rejecting former President Donald Trump's claims of executive privilege. https://t.co/fQ4XUxqRzI",washington president ordering release trump white house visitor log house committee investigating riot rejecting former president donald trump claim executive privilege,-1
Thu Feb 17 04:23:31 +0000 2022,joe biden,212,0,54,Usa,"according to us president joe biden, some 150,000 russian troops are still amassed on my cock n balls",according president russian troop still amassed cock ball,-1
Wed Feb 16 21:03:31 +0000 2022,nato,1096,74,444,Poland,"The International Committee of the Fourth International (ICFI) and the World Socialist Web Site unequivocally oppose the reckless drive of Washington and its NATO allies to instigate a war with Russia,
https://t.co/GjyKTi1B6G",international committee fourth international icfi world socialist web site unequivocally oppose reckless drive washington ally instigate war russia,-1
Wed Feb 16 21:03:02 +0000 2022,nato,137792,915,0,Austria,France urges revamp of Europe’s security order in face of Russia threat - French foreign minister Jean-Yves Le Drian says Nato has emerged stronger from current crisis... #financenews Read more on https://t.co/XndNgwtBbi https://t.co/f8uNCt0z0B,france urge revamp europe security order face russia threat french foreign minister drian say emerged stronger current crisis read,-1
Wed Feb 16 21:02:26 +0000 2022,nato,221883,10920,434,South Africa,Ukraine: Nato to send new battle groups to eastern Europe as Russia fails to deliver de-escalation https://t.co/fFcxF0ZtTB,send new battle group eastern europe russia fails deliver,-1
Wed Feb 16 21:02:08 +0000 2022,nato,36932,306,401,Usa,@thepig993 @SamRamani2 Ukraine is attempting to join NATO. This is a massive threat to Russian national security because its biggest European border is with Ukraine. Thus explaining why these troops are where they are…this new Western force in Russia will be there permanently as a deterrent (IMO),attempting join massive threat russian national security biggest european border thus explaining troop new western force russia permanently deterrent imo,1
Wed Feb 16 21:02:07 +0000 2022,nato,23096,8945,858,Usa,"In a joint statement issued Feb. 11, a senior group of 24 US, European, and Russian security experts fr  @deepcutsproject outlined a plan for defusing the Russia-NATO/US crisis over Ukraine. See the Deep Cuts Commission statement at https://t.co/Y8sYCmIYvX https://t.co/Lx5m3WtCZM",joint statement issued senior group european russian security expert outlined plan defusing crisis see deep cut commission statement,-1
Wed Feb 16 21:01:52 +0000 2022,nato,38353,258,381,Usa,Latest Ukraine Updates: NATO says no sign of Russia de-escalation | Ukraine-Russia crisis News | Al Jazeera https://t.co/bqzlnvMD4z,latest update say sign russia crisis news jazeera,-1
Wed Feb 16 21:01:24 +0000 2022,nato,12824,2876,2668,Australia,Putin 🤬🤬' More troops are on their way': NATO says Russia has not yet de-escalated situation at Ukraine border - ABC News https://t.co/vaxYSuwJdx,putin troop way say russia yet situation border abc news,0
Wed Feb 16 21:01:17 +0000 2022,nato,78322,302,719,Usa,"U.S., NATO say no signs Russia pulling back troops from near Ukraine https://t.co/GLGUCLqbGX via @nbcnews",say sign russia pulling back troop near via,0
Wed Feb 16 21:00:57 +0000 2022,nato,1853,71,253,Australia,"Russia- Ukraine crisis:
Russia doesn't take seriously NATO anymore.

#Russia #UkraineCrisis #Ukraina #NATO https://t.co/Ls7y8OUDhk",crisis russia take seriously anymore,-1
Wed Feb 16 21:00:33 +0000 2022,nato,137447,3291,1475,England,"@XSovietNews For considerable time there was no issue at all. Russia had huge soft power in all of them, idea of Russia being in NATO was seriously pitched and not dismissed as outlandish.
Then Putin lost it's cool. Rest is history as they say.",considerable time issue russia huge soft power idea russia seriously pitched dismissed outlandish putin lost cool rest history say,1
Wed Feb 16 21:00:01 +0000 2022,nato,16424,14604,328,Usa,"""Russia could settle for a moratorium on Ukrainian membership in NATO for, say, two decades, something the alliance should be able to accept because it has no plans to fast-track Kyiv’s membership anyway."" @rajan_menon_ via @TomDispatch:
https://t.co/RVQ33fEOvi",russia could settle moratorium ukrainian membership say two decade something alliance able accept plan kyiv membership anyway via,1
Wed Feb 16 21:00:01 +0000 2022,nato,4124,442,2,Pakistan,"NATO chief questions Russian troop retreat

#NATO @NATO #RussiaUkraineCrisis #Russia #Ukraine #pakistantimestoday 

https://t.co/Ht9NKmM4KI",chief question russian troop retreat,1
Wed Feb 16 21:00:00 +0000 2022,nato,188132,111976,134,Usa,"There have been no signs of Russian withdrawal from Ukraine’s border yet, according to Ukraine President Voldymyr Zelenskyy. | By @HerbScribner

https://t.co/6M4x3vamkw",sign russian withdrawal border yet according president voldymyr zelenskyy,0
Wed Feb 16 21:00:00 +0000 2022,nato,2395,7203,1236,Usa,"🥇Article of the Day🥇#Russia has a robust #HybridWarfare strategy for #Ukraine, and #NATO must bolster its defense capabilities to meet this challenge effectively. 
All #TNTAotD picks:https://t.co/s14OLF9IXR 
Read @realChrisDolan1: https://t.co/iwJFM1am30",robust strategy must bolster defense capability meet challenge effectively pick read,1
Wed Feb 16 20:59:49 +0000 2022,nato,23976,4533,920,England,"Confirming both the #US and #NATO assessments, the #UK Chief of Defence Intelligence has said ""we have not seen evidence that #Russia has withdrawn forces from #Ukraine’s borders"".",confirming assessment chief defence intelligence said seen evidence withdrawn force border,1
Wed Feb 16 20:59:14 +0000 2022,nato,49041,37697,36592,England,"Speaking after a meeting of NATO defence ministers in Brussels, Jens Stoltenberg stresses there is no sign of a military de-escalation from Russia.",speaking meeting defence minister brussels jens stoltenberg stress sign military russia,-1
Wed Feb 16 21:28:38 +0000 2022,nato,23962,3316,2724,Usa,"Ukraine live updates: #Russia increasing troop numbers, say #NATO - as Kremlin issues energy supply warning to Europe https://t.co/djmhFbGzKx #UkraineCrisis",live update increasing troop number say kremlin issue energy supply warning europe,-1
Wed Feb 16 21:27:50 +0000 2022,nato,10983,399,1253,Usa,@RWDiogo I don’t blame Putin at all for demanding NATO stay out of Ukraine.  Otherwise it makes the USA a giant hypocrite when it says thing about Cuba and the entire Western Hemisphere.,blame putin demanding stay otherwise make usa giant hypocrite say thing cuba entire western hemisphere,-1
Wed Feb 16 21:27:46 +0000 2022,nato,141817,4105,4984,France,"Satellite images prove Russian failure to withdraw troops, NATO says https://t.co/awwnI3Dngv",satellite image prove russian failure withdraw troop say,-1
Wed Feb 16 21:27:12 +0000 2022,nato,1008,14,390,Germany,@EndGameWW3 From today: NATO: satellite imagery shows that the Russian military is building field hospitals near the Ukraine border,today satellite imagery show russian military building field hospital near border,0
Wed Feb 16 21:27:02 +0000 2022,nato,551024,6747,5461,Usa,"US and NATO deem Russia a persistent threat to Europe, will add battlegroups in response #SmartNews #Ukraine https://t.co/VGolfqMEKL",deem russia persistent threat europe add battlegroups response,-1
Wed Feb 16 21:26:09 +0000 2022,nato,619208,8152,7167,Usa,I remember him saying both sides need to deescalate tensions.  My view was that NATO was formed to keep Russia in check and Ukraine is not in NATO.  Maybe talk with allied nations before making a statement would be good.,remember saying side need deescalate tension view formed keep russia check maybe talk allied nation making statement would good,1
Wed Feb 16 21:25:52 +0000 2022,nato,14369,184,5001,Usa,"Russia is continuing its military buildup around Ukraine, NATO’s chief said. “We have not seen any de-escalation on the ground.” https://t.co/LxRAIaL9XQ via @WSJ",russia continuing military buildup around chief said seen via,0
Wed Feb 16 21:25:51 +0000 2022,nato,7279,266,1323,Usa,"1:30 in, ""a shitshow of NATO unity"" 

😬

Russia's latest military movements stoke confusion - https://t.co/vppOVGTqti",shitshow unity russia latest military movement stoke confusion,-1
Wed Feb 16 21:25:44 +0000 2022,nato,6209,825,1472,Usa,@SBirke79 @marynlm Ukraine is not a NATO member. Let Putin try invading a NATO country. That will be the real test.,member let putin try invading country real test,0
Wed Feb 16 21:25:40 +0000 2022,nato,83508,3151,4995,Australia,"Russia still building forces on Ukraine border, says top Nato official https://t.co/4ovcrzuewY",russia still building force border say top official,1
Wed Feb 16 21:44:58 +0000 2022,nato,37866,2608,2262,Usa,"@FoxNews BS. Biden had same question....""what do they stand for?"" Everything in place before pandemic which Biden reversed entering office. Highest GDP, best employment, energy independence, controlled border, NATO paying fair share, no wars. Joe's changes. Now on He and Chuckie must fix",biden question stand everything place pandemic biden reversed entering office highest gdp best employment energy independence controlled border paying fair share war joe change chuckie must fix,1
Wed Feb 16 21:43:04 +0000 2022,nato,213173,3661,1972,Usa,"The former head of MI6 Sir #JohnSawers has given a startling interview on #BBC Radio 4, in which he outlines the view that Russia never had any intention of invading Ukraine, &amp; that the threat has been greatly exaggerated by Western leaders.

#Russia #Ukraine #UK #US @NATO #MI6 https://t.co/5TDp1Eyqbr",former head sir given startling interview radio outline view russia never intention invading amp threat greatly exaggerated western leader,-1
Wed Feb 16 21:42:41 +0000 2022,nato,515946,12543,12674,Usa,"Ukrainian Pacifists Say US, NATO and Russia Share Responsibility to Avoid War https://t.co/R0zNRRxsjP via @truthout",ukrainian pacifist say russia share responsibility avoid war via,-1
Wed Feb 16 21:42:28 +0000 2022,nato,165046,2968,5001,Switzerland,"Russia increasing troop numbers, say NATO - as Kremlin issues energy supply warning to Europe

https://t.co/ZkNbKJlt4S",russia increasing troop number say kremlin issue energy supply warning europe,-1
Wed Feb 16 21:42:04 +0000 2022,nato,662845,643193,156,Ireland,Alliance chief says Russia is continuing its military build-up near Ukraine border https://t.co/JiX3y9HONo,alliance chief say russia continuing military near border,0
Wed Feb 16 21:41:40 +0000 2022,nato,4581,164,418,Usa,@LIbeaches15 @triflerose No but maybe Putin is upset that Biden and Nato are pushing Ukraine to join Nato.  2/3 of Russia's army?  Maybe like 1/3?   I could be wrong.,maybe putin upset biden pushing join russia army maybe like could wrong,-1
Wed Feb 16 21:40:13 +0000 2022,nato,72656,1170,1007,Usa,@vicktop55 Germany needs Nord Stream 2 so I don't expect Germany putting up with Ukrainian adventurism. I don't think France will either. If the US forces Ukraine into conflict in the Donbass it may split NATO. It will also further split Ukraine. Partition of Ukraine may be sensible.,germany need nord stream expect germany putting ukrainian adventurism think france either force conflict donbas may split also split partition may sensible,1
Wed Feb 16 22:00:49 +0000 2022,nato,25,0,49,Usa,"@OmegonAlpha @EndGameWW3 If a bluff: it was expensive, didn’t work, strengthened Ukraines military, increased anti-Russian sentiment in neighboring countries, and led to more NATO presence in Eastern Europe. Russian forces are massing and preparing infrastructure. Seems like Putin still has more planned.",bluff expensive work strengthened military increased sentiment neighboring country led presence eastern europe russian force massing preparing infrastructure seems like putin still planned,1
Wed Feb 16 21:59:55 +0000 2022,nato,258459,1270,154,Germany,"NOW BOTH GERMANY AND US ARE TIRED OF WATING FOR WHAT THEY ASSUMED PUTIN WOULD DO NEXT...MEANING STAND DOWN AND MOVEBACK TO BASE

THIS IS AS UNIFIED AS U WILL SEE NATO AND THE US...PUTIN NEEDS TO UNDERSTAND HE IS CUTTING HIMSELF OFF OF THE 500M GERMANY INVESTMENT YEARLY INTO https://t.co/EHQXYl4Nx6",germany tired wating assumed putin would next meaning stand moveback base unified see putin need understand cutting germany investment yearly,-1
Wed Feb 16 21:58:33 +0000 2022,nato,4755,5111,494,Usa,"1️⃣ #NATO Allies bolstered their defenses by sending troops and equipment to 🇵🇱 &amp; 🇱🇹 and #Turkey began providing drones to Kyiv. All this as #Ukraine prepares to unplug from Russian electricity amid fears of invasion. 

More 👉 https://t.co/rL15nj20hA (3/7)",ally bolstered defense sending troop equipment amp began providing drone kyiv prepares unplug russian electricity amid fear invasion,-1
Wed Feb 16 21:58:12 +0000 2022,nato,38154,1640,1684,Usa,"2/16/22 Tulsi Gabbard on Fox talking about inflation, gas prices, US &amp; Nato, Ukraine and Russia, and more.

#TulsiGabbard #Tulsi #inflation #InflationRate #GasPrice #USA #NATO #UkraineCrisis #RussiaUkraine #nowarinukraine 

https://t.co/YutIpAPCYY",tulsi gabbard fox talking inflation gas price amp russia,-1
Wed Feb 16 21:57:47 +0000 2022,nato,4138,164,1097,Usa,"Well ya 😔
Fox News: China says US is 'playing up' Russia threat to Ukraine.
https://t.co/bASLK7RZif

via @GoogleNews",well fox news china say russia threat via,-1
Wed Feb 16 21:57:32 +0000 2022,nato,24197,636,234,Usa,Important to know that the announced Russian troop withdrawal is about exercises they were doing in Crimea. https://t.co/BITZNT8WBm,important know announced russian troop withdrawal exercise crimea,1
Wed Feb 16 21:56:31 +0000 2022,nato,4863,5265,397,Usa,".#Putin blamed Russia's ongoing military escalation on the United States, NATO, and #Ukraine. 
 https://t.co/VRkozUgqSa",blamed russia ongoing military escalation united state,-1
Wed Feb 16 21:56:22 +0000 2022,nato,85940,779,1616,Usa,I think We had better wake up that NATO is going to have to fight a war for democracy against China and Russia.,think better wake going fight war democracy china russia,-1
Wed Feb 16 21:56:11 +0000 2022,nato,628432,574,587,Usa,"No sign of withdrawal of #Russian troops near #Ukraine, #NATO chief says - #BBC News https://t.co/Y4U1DkORNB",sign withdrawal troop near chief say news,0
Wed Feb 16 21:55:42 +0000 2022,nato,94363,13830,14788,Usa,"No sign of withdrawal of #Russian troops near #UkraineBorder , @NATO chief says - ... https://t.co/Ig5cpwwTIb via @YouTube",sign withdrawal troop near chief say via,0
Wed Feb 16 21:55:13 +0000 2022,nato,33083,335958,77,England,FirstFT: Nato says Russian troop numbers still rising near Ukraine https://t.co/6snZ7uUuqq,firstft say russian troop number still rising near,0
Wed Feb 16 21:54:52 +0000 2022,nato,211997,10420,9583,Usa,NATO allies gang up against Russia despite troop draw down (full show) https://t.co/UqLGYbsqSa via @YouTube,ally gang russia despite troop draw full show via,0
Wed Feb 16 21:54:18 +0000 2022,nato,30023,126,1637,Usa,"U.S., NATO cite continuing Russian threat to Ukraine despite pullback claims - The Washington Post https://t.co/dKIL7gpryb",cite continuing russian threat despite pullback claim washington post,-1
Wed Feb 16 22:13:43 +0000 2022,nato,1444,3,245,Usa,"@Servelan BREAKING NEWS

NATO rejects claims Russian troops are pulling back, because they are still in Russia",breaking news reject claim russian troop pulling back still russia,-1
Wed Feb 16 22:13:34 +0000 2022,nato,260854,1158,44,England,"NATO chief contradicts Russia withdrawal claims, says no proof of pulling back https://t.co/DwTHTyBa65",chief contradicts russia withdrawal claim say proof pulling back,-1
Wed Feb 16 22:13:33 +0000 2022,nato,12319,318,605,Ireland,"@TonyWoo12578965 @comrade_eg @waltshaub @TonyH_Pattaya FYI Stalin's Russia died in the 90s and he was from Georgia.
NATO Putin actually wants to join NATO when he took over to have better for operation with Western Europe.
Then people who want to sell Arms wouldn't like that.",fyi stalin russia died georgia putin actually want join took better operation western europe people want sell arm would like,-1
Wed Feb 16 22:12:05 +0000 2022,nato,3511,42,171,Usa,"@MMFlint Russia wants autonomous regions within Ukraine to prevent them joining NATO, we want chaos to kill Nordstream 2 and sell them gas. As usual, the rich and powerful are stoking conflict to gain more power and make more money.",russia want autonomous region within prevent joining want chaos kill nordstream sell gas usual rich powerful stoking conflict gain power make money,-1
Wed Feb 16 22:11:59 +0000 2022,nato,549,7,7,Usa,"@SoCalCoasty @Brettcarrr @CFL68 @DavidGo72310816 @BorisJohnson do u think russia is going to keep withdrawing troops as nato sends more troops to the border no, they wont because now NATO is using intimidation to get russia to back down.",think russia going keep withdrawing troop sends troop border wont using intimidation get russia back,1
Wed Feb 16 22:11:36 +0000 2022,nato,696957,12309,12,Usa,"Ukrainian President Volodymyr Zelensky says no evidence Russia withdrawing troops 

https://t.co/y1D11VpBA2",ukrainian president volodymyr zelensky say evidence russia withdrawing troop,0
Wed Feb 16 22:11:26 +0000 2022,nato,39437,343,401,France,"Nato says Russian troop numbers still rising near Ukraine border
https://t.co/uH1VFvmvTQ",say russian troop number still rising near border,0
Wed Feb 16 22:11:02 +0000 2022,nato,35771,1321,229,England,If Russia invaded Ukraine with NATO involved and ready for battle the Russian mil will be devastated as NATO has superior tech and capabilities. It would be a significant military defeat for Russia. But only if NATO is battle ready and deployed. Its not for at least 28 days!,russia invaded involved ready battle russian mil devastated superior tech capability would significant military defeat russia battle ready deployed least day,-1
Wed Feb 16 22:10:53 +0000 2022,nato,549,7,7,Canada,"@SoCalCoasty @Brettcarrr @CFL68 @DavidGo72310816 @BorisJohnson lets take a nice long look at the current crisis, right now russia has some 130k troops 250km give or take from the border, nato member states want a de-escalation but are still sending more troops to the border. not de-escalting but escalating the situation.",let take nice long look current crisis right russia troop give take border member state want still sending troop border escalating situation,-1
Wed Feb 16 22:30:42 +0000 2022,nato,3100,203,280,Usa,"@leesuigeneris I'm not a Bolton supporter by any stretch. Now on that point we agree, Bolton loves war and personally I believe he's a war profiteer. But when he's right, he's right. #PutinsBitch would've disbanded NATO by now and rolled red carpet right to Kyiv for Russian troops.",bolton supporter stretch point agree bolton love war personally believe war profiteer right right would disbanded rolled red carpet right kyiv russian troop,1
Wed Feb 16 22:29:02 +0000 2022,nato,30921,12,102,Usa,"The current crisis between Russia and the West is fueled by a fallacious claim by Russian President Vladimir Putin that the U.S., misled the Soviet Union that NATO would not expand to the east.

Source link",current crisis russia west fueled fallacious claim russian president vladimir putin misled soviet union would expand east source link,-1
Wed Feb 16 22:29:02 +0000 2022,nato,20456,4008,614,Germany,"What about NATO =US if Russia had weapons in Venezuelan, Cuba, Mexico  OR in the Us border. US Hypocrisy https://t.co/UHwJC0qozw",russia weapon venezuelan cuba mexico border hypocrisy,-1
Wed Feb 16 22:28:53 +0000 2022,nato,399867,6748,6303,Usa,Biden Tells Putin What Trump Never Would: The US Will Defend Every Inch Of NATO Territory https://t.co/DIQzVTU1tB,biden tell putin trump never would defend every inch territory,0
Wed Feb 16 22:28:26 +0000 2022,nato,208934,5678,5868,Usa,"NATO warns Russia still building up troops, as Ukraine holds defiant national holiday  https://t.co/2omXxCFpbA",warns russia still building troop hold defiant national holiday,1
Wed Feb 16 22:28:24 +0000 2022,nato,30631,607,567,Usa,"@JeremyWard33 No sentient being would invade Ukraine, a failed State.
Nothing but liabilities.
Intervention to protect 1/3rd of the population that is ethnic Russian would be a win.
Did I mention Russia (rightly) will NEVER let Ukraine join NATO?",sentient would invade failed state nothing liability intervention protect population ethnic russian would win mention russia rightly never let join,-1
Wed Feb 16 22:28:12 +0000 2022,nato,1867,5165,66,Pakistan,"China Accuses U.S. of ""Playing Up the Threat of Warfare"" Between Russia and Ukraine
Click the link for details:
https://t.co/fHIo7KcCiV
#raahtv #China #Russia #Russian #putin #XiJinping #Ukraine #Kiev #kyiv #nato #Australia #US #USA #EU #Moscow #pentagon https://t.co/94tcZFFIcM",china accuses playing threat warfare russia click link detail,-1
Wed Feb 16 22:27:58 +0000 2022,nato,46077,123,145,Usa,"@27khv I’ll give these goofs until 9:30 a.m. MST, February 17th. But if we get to 9:31 a.m. with no invasion having commenced, I want them, Biden, NATO member leaders, Stoltenberg too, to drink hemlock. Or commit to ignore any statement in future that starts: “US intelligence says…”.",give goof mst february get invasion commenced want biden member leader stoltenberg drink hemlock commit ignore statement future start intelligence,1
Wed Feb 16 22:27:55 +0000 2022,nato,30530,880,575,Usa,@starsandstripes Anybody stop to think that the US/UK/NATO Troika of Tyranny is the true threat and Russia is only responding to it?,anybody stop think troika tyranny true threat russia responding,-1
