created_at,query,statuses_count,followers_count,friends_count,user_location,full_text,cleaned,class
Sun Feb 20 01:30:01 +0000 2022,SurvivorAU,9832,2723,694,Usa,"#SurvivorAU voting notes:
• 81 votes have been cast.
• Sandra, Sophie &amp; “Juicy Dave” have all seen their name the most times (13) but 8 of Juicy’s votes were negated by his idol play.
• “Juicy Dave” is the only player left in the game that has received more than two votes (5).",voting note vote cast sandra sophie amp juicy dave seen name time juicy vote negated idol play juicy dave player left game received two vote,1
Sun Feb 20 01:30:00 +0000 2022,SurvivorAU,9832,2723,694,Usa,"#SurvivorAU vote totals by player through week 3 (episode 9):
• Eliminated players are greyed out.
• Votes negated by idols are not counted but are visualized in the graphic.
• Colors represent the tribe on which the votes were cast. https://t.co/NbkpGybP4O",vote total player week episode eliminated player greyed vote negated idol counted visualized graphic color represent tribe vote cast,0
Sun Feb 20 02:07:10 +0000 2022,SurvivorAU,1453,23,99,Canada,"Got a like &amp; comment on IG from @DavidGenat, international model and star of #SurvivorAU s06 &amp; s07! 📺🌴🗿🇦🇺🐨🦘 https://t.co/6IeqmHS25G",got like amp comment international model star amp,1
Sun Feb 20 02:20:06 +0000 2022,SurvivorAU,156018,2818,101,Australia,"📺 💥 Massive Sunday!

Where will your eyes be drawn TONIGHT? 👀

•7: #DancingAU launch &gt; #FigureSkating Gala &gt; #ClosingCeremony

•9: #MAFS &gt; #60mins

•10: #SurvivorAU

•ABC: #GrandDesigns NZ &gt; #Vera https://t.co/w1Wv645hwl",massive sunday eye drawn tonight launch gala,1
Sun Feb 20 02:16:45 +0000 2022,SurvivorAU,21254,784,706,Canada,Starting Season 6 of #SurvivorAU (my first viewing of Survivor AU) … promising? but definitely the least diverse season of Survivor I’ve seen thus far 😶,starting season first viewing survivor promising definitely least diverse season survivor seen thus far,0
Sun Feb 20 03:39:15 +0000 2022,SurvivorAU,2704,227,222,Australia,Just screenshotting this in case I need to express extreme spoiler outrage tonight 😒 #SurvivorAU https://t.co/fwJZBsEIM7,screenshotting case need express extreme spoiler outrage tonight,-1
Sun Feb 20 12:51:45 +0000 2022,SurvivorAU,837,2969,364,Australia,@Nina_UnTwined was on absolute fire. I actually teared up when she got out of that blue car in a moon boot. #SurvivorAU,absolute fire actually teared got blue car moon boot,1
Sun Feb 20 12:42:46 +0000 2022,SurvivorAU,14367,161,976,Australia,@PreviouslyonAS I reckon they scraped the 48 hour medical pass thing because of all our complaining last year and loosing Alex and Nina is what we get 4 all our whining. Which is honestly the worst punishment known to man #SurvivorAU,reckon scraped hour medical pas thing complaining last year loosing alex nina get whining honestly worst punishment known man,-1
Sun Feb 20 12:30:17 +0000 2022,SurvivorAU,4328,314,837,Australia,I'm sorry... Am I the only one who didn't know that @JLa_Paglia had a successful career as an ED doctor before pursuing acting?!? #SurvivorAU,sorry one know successful career doctor pursuing acting,1
Sun Feb 20 12:10:07 +0000 2022,SurvivorAU,4115,100,151,Australia,I went from being impressed with Chrissy’s comment about ‘not actually flushing an idol if he doesn’t know about it’ to ‘OMG what are you doing telling Ben?!’ within 5 minutes @ShannonGaitz 😂 #SurvivorAU,went impressed chrissy comment actually flushing idol know omg telling ben within minute,-1
Sun Feb 20 12:08:18 +0000 2022,SurvivorAU,4495,206,1477,Australia,Can't imagine much worse than leaving survivor because of injury. Nina was an amazing player and I can't wait to see her play either survivor or #SurvivorAU sometime soon,imagine much worse leaving survivor injury nina amazing player wait see play either survivor sometime soon,-1
Sun Feb 20 12:07:25 +0000 2022,SurvivorAU,24954,1291,911,Usa,"Noooo Nina FCKKKKKKKKK! I hate Injuries! Lowkey, I really don’t even wanna watch anymore  #SurvivorAU",hate injury lowkey really even wan watch anymore,-1
Sun Feb 20 11:55:19 +0000 2022,SurvivorAU,83,538,48,Australia,Nothing is fair in this game. But going out due to injury is by far the cruelest twist of fate. My heart breaks for Nina. JLP better be a man if his word. #SurvivorAU 😢,nothing fair game going due injury far cruelest twist fate heart break nina jlp better man word,-1
Sun Feb 20 11:50:38 +0000 2022,SurvivorAU,1776,125,1339,Australia,Such a sad way for @Nina_UnTwined  to leave the game. We have been robbed of what could have been an amazing game. Hope to see her pop up on Survivor again soon. #SurvivorAU,sad way leave game robbed could amazing game hope see pop survivor soon,1
Sun Feb 20 11:49:21 +0000 2022,SurvivorAU,735,379,682,Australia,"This is what we can be pretty sure of, right? It looked like Chrissy was about to write Ben. Does that mean Michelle voted KJ? 

Ben -&gt; Khanh
Croc -&gt; Khanh
Jesse -&gt; Ben
Sam -&gt; Ben
Khanh -&gt; Ben
Chrissy -&gt; ?
Michelle -&gt; ?
KJ -&gt; Ben or Khanh

#SurvivorAU",pretty sure right looked like chrissy write ben mean michelle voted ben khanh croc khanh jesse ben sam ben khanh ben chrissy michelle ben khanh,0
Sun Feb 20 11:44:09 +0000 2022,SurvivorAU,773,51,392,Australia,"First the Voice and now Dancing with the stars.. @Channel7 you are brave but no chance against #SurvivorAU and #MAFS.
Guess you had to try something!
#NoChance #ratings #Brave",first voice dancing star brave chance guess try something,-1
Sun Feb 20 11:27:30 +0000 2022,SurvivorAU,4495,206,1477,Australia,"KJ was the right choice for the majority. Unlike Khahn, her tribe voted out her loved one so no built in animosity + no worry about an idol. Adding Ben creates a new power couple. If KJ doesn't work out, she can be voted off cleanly unlike Ben (Shay impact) or Khahn #SurvivorAU",right choice majority unlike khahn tribe voted loved one built animosity worry idol adding ben creates new power couple work voted cleanly unlike ben shay impact khahn,1
Sun Feb 20 11:25:38 +0000 2022,SurvivorAU,614,18,221,Australia,@JLa_Paglia Planting a seed - I think Chrissy’s ‘22 sole survivor with a Bradbury finish (&amp; I don’t mean S6). #SurvivorAU,planting seed think chrissy sole survivor bradbury finish amp mean,1
Sun Feb 20 11:24:25 +0000 2022,SurvivorAU,18903,786,364,Australia,"Devo for Nina! 

Such a strong player who ticks all the box's

Seeing everyone rally behind her was good to see. Hope to see her play again

#SurvivorAU",devo nina strong player tick seeing everyone rally behind good see hope see play,1
Sun Feb 20 11:21:33 +0000 2022,SurvivorAU,3686,118,746,Australia,@ShannonGaitz @Jommacc Im hoping it’s for the farewell special and then she’s here to film previews for #SurvivorAU Season 07………Heroes vs Villains,hoping farewell special film preview season villain,0
Sun Feb 20 11:18:52 +0000 2022,SurvivorAU,2376,76,152,Australia,May the weasel brothers go soon !! J&amp;J #SurvivorAU,may weasel brother soon amp,0
Sun Feb 20 11:18:50 +0000 2022,SurvivorAU,894,27,456,Indonesia,This isn't even that hard to predict since it had been telegraphed by Survivor AU's social media accounts all goddamn week #SurvivorAU https://t.co/z4sBl6IzT3,even hard predict since telegraphed survivor social medium account goddamn week,-1
Sun Feb 20 11:17:29 +0000 2022,SurvivorAU,8878,109,388,Australia,@Survivor_AU Is it too late to compile all of the Buddha/zen comments from @JLa_Paglia and make a coffee table book?? Please don't steal this idea #SurvivorAU,late compile comment make coffee table book please steal idea,-1
Sun Feb 20 11:17:00 +0000 2022,SurvivorAU,2532,60,118,Australia,"On behalf of Australia, I personally would like to thank the red tribe for not putting the insufferable couple that is Ben &amp; Shae within 1 metre of each other, with thanks. #survivorau https://t.co/J0E1DbkKxL",behalf australia personally would like thank red tribe putting insufferable couple ben amp shae within metre thanks,1
Sun Feb 20 11:16:41 +0000 2022,SurvivorAU,50899,2001,130,Australia,so were getting an epic blindside tomorrow 👀 i guess that means it wont be ben lol #SurvivorAU,getting epic blindside tomorrow guess mean wont ben lol,1
Sun Feb 20 11:15:27 +0000 2022,SurvivorAU,50899,2001,130,Australia,its a bit ironic that both kj and sophie swapped tribes after a non elimination twist #SurvivorAU,bit ironic sophie swapped tribe non elimination twist,-1
Sun Feb 20 11:14:30 +0000 2022,SurvivorAU,50899,2001,130,Australia,"i might dislike jordie at times but i think that’s actually pretty good gameplay to snatch kj and leave ben to self implode, though it might not be good for his brother #SurvivorAU",might dislike jordie time think actually pretty good gameplay snatch leave ben self implode though might good brother,1
Sun Feb 20 11:12:19 +0000 2022,SurvivorAU,14367,161,976,Australia,@ShannonGaitz I can now relate too the song soon you’ll get better by Taylor swift that’s 4 sure #SurvivorAU #Nina,relate song soon get better taylor swift sure,1
Sun Feb 20 11:11:42 +0000 2022,SurvivorAU,163964,13262,7413,Australia,"In retrospect, it should’ve been obvious that no one would go home tonight, with Nina having gone home #survivorau",retrospect obvious one would home tonight nina gone home,0
Sun Feb 20 11:06:58 +0000 2022,SurvivorAU,11901,404,890,Australia,Survivor Australia I don’t watch it but how come now there are 2 tribes #red #blue it has there always been 2 tribes? #SurvivorAU,survivor australia watch come tribe always tribe,0
Sun Feb 20 11:05:22 +0000 2022,SurvivorAU,62586,835,3245,Australia,"With Nina medivacced, they needed to put another non-elimination in somewhere instead of the usual 1 pre and 1 post merge. When Blood tribe turned up, Water should have realised #SurvivorAU",nina medivacced needed put another somewhere instead usual pre post merge blood tribe turned water realised,0
Sun Feb 20 11:05:01 +0000 2022,SurvivorAU,64814,1385,989,Australia,"though tbh I think this was a sudden change in the game as a response to Nina leaving the game, as they said only three people leave this week #SurvivorAU",though tbh think sudden change game response nina leaving game said three people leave week,0
Sun Feb 20 11:04:44 +0000 2022,SurvivorAU,50899,2001,130,Australia,queen mel holding onto that advantage to get that screen time production refuses to give her #SurvivorAU,queen mel holding onto advantage get screen time production refuse give,1
Sun Feb 20 11:04:22 +0000 2022,SurvivorAU,64814,1385,989,Australia,"does this mean that no one gets voted out, someone just swaps tribes? every time a good blue blindside happens there’s a twist, they can’t catch a break! #SurvivorAU",mean one get voted someone swap tribe every time good blue blindside happens twist catch break,-1
Sun Feb 20 11:00:29 +0000 2022,SurvivorAU,773,51,392,Australia,"Obvious once a player leaves the game through injury that no one will go home...so why would they do a blindside? Also I know they tried to spice it up with an advantage for the red team but kind of a waste of an episode
#SurvivorAU #blindside #FAIL",obvious player leaf game injury one home would blindside also know tried spice advantage red team kind waste episode,-1
Sun Feb 20 10:56:13 +0000 2022,SurvivorAU,50899,2001,130,Australia,so we really got a confessional from everyone on the water tribe except michelle while mel has set a new record for going the longest without a confessional… honestly wtf did the twins do to make the editors hate them like this #SurvivorAU,really got confessional everyone water tribe except michelle mel set new record going longest without honestly wtf twin make editor hate like,-1
Sun Feb 20 10:52:22 +0000 2022,SurvivorAU,29323,1056,880,Australia,Oh that’s a shame I’ve been enjoying both members of the American team .. I’m glad they were invited ! Thanks @Survivor_AU ! Bye Nina ! #SurvivorAU,shame enjoying member american team glad invited thanks bye nina,1
Sun Feb 20 10:51:35 +0000 2022,SurvivorAU,50899,2001,130,Australia,i love these kj confessionals. she comes across as a really insightful player and i think she could be one to watch #SurvivorAU,love confessional come across really insightful player think could one watch,1
Sun Feb 20 10:50:46 +0000 2022,SurvivorAU,2716,229,223,Australia,What are the chances we get a final two of loved ones? Mel and Michelle. But everyone gets confused about who to vote for. #SurvivorAU https://t.co/knvBYjR1cH,chance get final two loved one mel michelle everyone get confused vote,1
Sun Feb 20 10:50:05 +0000 2022,SurvivorAU,38171,392,610,Australia,"If looks could kill, Shay would have turned the Blood tribe to dust 😡 #SurvivorAU",look could kill shay would turned blood tribe dust,-1
Sun Feb 20 10:50:04 +0000 2022,SurvivorAU,64034,708,2699,Australia,Brains Vs Brawn twists &gt;&gt;&gt; Blood vs Water twists #SurvivorAU,brain brawn twist blood water twist,0
Sun Feb 20 10:47:02 +0000 2022,SurvivorAU,110494,1610,1396,Australia,"Would’ve have been better, if the one with the most votes wasn’t chosen by Blood, they still got sent home. #SurvivorAU",would better one vote chosen blood still got sent home,0
Sun Feb 20 10:43:21 +0000 2022,SurvivorAU,62586,835,3245,Australia,"If the goal is to flush the idol, putting the majority of votes on the non-idol holder doesn't make sense. #SurvivorAU",goal flush idol putting majority vote holder make sense,0
Sun Feb 20 13:05:10 +0000 2022,SurvivorAU,22988,278,168,Australia,Ughhhhhh so sick of these twists 😴 but at the same time Blue should’ve paid attention to the advantage #SurvivorAU,ughhhhhh sick twist time blue paid attention advantage,-1
Sun Feb 20 13:03:33 +0000 2022,SurvivorAU,4168,69,150,Australia,"Blue tribe was a complete cluster **** tonight. 
It was like none of them have ever watched an episode of #SurvivorAU in their life. Bad, bad, bad play from so many of them.",blue tribe complete cluster tonight like none ever watched episode life bad bad bad play many,0
Sun Feb 20 13:02:13 +0000 2022,SurvivorAU,13037,626,2196,Australia,So unreal @Nina_UnTwined Sending you love. I can’t even begin to imagine something we are so passionate and love so much ending so abruptly becoz of an external factor. An amazing player and I cheered for you every second of the way. I hope we get to see you again #SurvivorAU,unreal sending love even begin imagine something passionate love much ending abruptly becoz external factor amazing player cheered every second way hope get see,1
Sun Feb 20 12:58:29 +0000 2022,SurvivorAU,7957,117,437,Usa,"@KingGeorge2200 @Nina_UnTwined For me it was when the blue car first appeared.  That is when I knew her game was over.  Such a sad moment. 
 #SurvivorAU",blue car first appeared knew game sad moment,-1
Sun Feb 20 13:15:45 +0000 2022,SurvivorAU,8931,197,892,Australia,I guess we don't need to watch @Survivor_AU Tribal anymore? Since most are saved by stupid twists.  #SurvivorAU,guess need watch tribal anymore since saved stupid twist,-1
Sun Feb 20 13:15:22 +0000 2022,SurvivorAU,6153,2233,2770,Australia,"Ok my stan list of people who are left

Ben (thats a KING), Chrissy (purr), Michelle (for having Sandra's back gets my stan card), Sam (i think shes GOOD),  

#SurvivorAu",stan list people left ben thats king chrissy purr michelle sandra back get stan card sam think shes good,0
Sun Feb 20 13:39:44 +0000 2022,SurvivorAU,357,33,44,Usa,"#SurvivorAU

Shots fired and missed. 🔫

Blue wanted Ben gone and Jonathan throws in a #twist

Wait and watch for the wrath of Ben https://t.co/eNFU6zKQAT",shot fired missed blue wanted ben gone jonathan throw wait watch wrath ben,-1
Sun Feb 20 13:30:09 +0000 2022,SurvivorAU,13042,626,2196,South Africa,They just lost Nina…there’s still 200 days left … I didn’t think we would get a double…great twist though poppe gaan dans #SurvivorAU,lost still day left think would get twist though poppe gaan dans,-1
Sun Feb 20 13:57:08 +0000 2022,SurvivorAU,5567,210,1130,Canada,"KJ is the right person to steal, you don’t want the idol on your tribe and Keeping Ben over on Water keeps the loved ones safe on red for everyone but Shay 🤷‍♂️ #SurvivorAU",right person steal want idol tribe keeping ben water keep loved one safe red everyone shay,1
Sun Feb 20 13:55:46 +0000 2022,SurvivorAU,2386,81,215,Israel,"I don’t think I’ve even been 💔 by a medevac in 50+ seasons of #Survivor as I’ve been by this one
@Nina_UnTwined you should be so proud, you blew everyone’s expectations out of the water, a true heiress to the 👸🏽 and I prey we’ll see you play again
#SurvivorAU #QueenStaysQueen",think even medevac season one proud blew everyone expectation water true heiress prey see play,1
Sun Feb 20 13:54:25 +0000 2022,SurvivorAU,22795,932,654,India,Who voted for KJ? Seeing the red tribe in tribal she could probably voted for herself🤔 #SurvivorAU,voted seeing red tribe tribal could probably voted,0
Sun Feb 20 13:51:09 +0000 2022,SurvivorAU,783,137,801,Usa,"@Survivor_AU is fantastic but DON’T follow any of the cast, host, or the show on social media unless you’d like to know what happens in the show before you get a chance to watch. Queen of spoilers. #ugh #SurvivorAU",fantastic follow cast host show social medium unless like know happens show get chance watch queen spoiler,-1
Sun Feb 20 14:06:37 +0000 2022,SurvivorAU,1691,191,785,Usa,Okay first Sandra got voted out on day 16 again X3  and now Nina is med evac? It can get more worse than that? 💔😭 #SurvivorAU,okay first sandra got voted day nina med evac get worse,-1
Sun Feb 20 14:05:15 +0000 2022,SurvivorAU,43848,683,687,India,"if kj goes home tomorrow, ill riot #SurvivorAU BLOOD TRIBE IS 🤢",home tomorrow ill riot blood tribe,-1
Sun Feb 20 14:17:54 +0000 2022,SurvivorAU,43851,683,687,India,ALSO IM SAD NINA WENT HOME PLSSS I HATE IT HEAR!!! THEY SHOULD'VE ATLEAST RIGGED IT FOR SANDRA NAUR #SurvivorAU,also sad nina went home plsss hate hear atleast rigged sandra naur,-1
Sun Feb 20 14:41:27 +0000 2022,SurvivorAU,18022,1683,1571,Usa,"- There's 15 castaways and left only 6 are women (two of which are invisible). The women were dominating the early stages of this game. 
- I'm worried for Shay and I wish she still had her idol. Nina leaving is not good for her game.
- Rooting for Sam at this point.
#SurvivorAU",castaway left woman two invisible woman dominating early stage game worried shay wish still idol nina leaving good game rooting sam point,0
Sun Feb 20 14:41:27 +0000 2022,SurvivorAU,18022,1683,1571,Usa,"- I would have liked that twist better if Ben still went home.
- Jesse came to play, but I think the fact that Ben is still around with Croc is a bit worrisome. And CJ's confessional about being told what to do by a 21 year old...says a lot about perception.  
#SurvivorAU",would liked twist better ben still went home jesse came play think fact ben still around croc bit worrisome confessional told year old say lot perception,1
Sun Feb 20 14:41:26 +0000 2022,SurvivorAU,18022,1683,1571,Usa,"#SurvivorAU ep 10:
- I AM DEVASTATED that Nina got injured. I really think she could have won this game. Even if she returns to AU in the future, she will have a much bigger target on her back. I hope she goes on the US version first since most folks will not know who she is. 💔 https://t.co/BWSS0S4ELY",devastated nina got injured really think could game even return future much bigger target back hope version first since folk know,-1
Sun Feb 20 14:31:45 +0000 2022,SurvivorAU,4293,98,407,Usa,oh the struggles having to watch #SurvivorAU from a facebook group where homies puttin the wrong passwords😭,struggle watch facebook group homies puttin wrong,0
Sun Feb 20 14:47:58 +0000 2022,SurvivorAU,2844,292,1474,Canada,My heart absolutely breaks for _______. She was doing so well and I hated to watch her go out like that. I’m glad that they mentioned she will likely return but the foundation she already set up in this game will be gone 😢 #SurvivorAU,heart absolutely break well hated watch like glad mentioned likely return foundation already set game gone,-1
Sun Feb 20 15:09:44 +0000 2022,SurvivorAU,11654,301,508,Usa,I can't figure out if I want Sam or Mark as my winner pick. Good sign for them that I think they both have a shot though. #SurvivorAU,figure want sam mark winner pick good sign think shot though,1
Sun Feb 20 15:21:25 +0000 2022,SurvivorAU,9877,571,1210,Usa,There's like no reason to watch #SurvivorAU when I get the boot spoiled every single episode,like reason watch get boot spoiled every single episode,-1
Sun Feb 20 15:00:50 +0000 2022,SurvivorAU,378,20,9,Usa,"Definitely one of the biggest contenders to win this season, sad to see her go out this way. Hopefully we get to see her play US Survivor or Survivor AU again 🤞#SurvivorAU #Survivor #Survivor42 https://t.co/op85L2lxR7",definitely one biggest contender win season sad see way hopefully get see play survivor survivor,1
Sun Feb 20 15:29:42 +0000 2022,SurvivorAU,6141,96,285,Usa,#SurvivorAU why are Mel and Mitchelle so expendable?? 😭😭 there is a power core group that seems so obvious.. idk why everyone can't see it? Croc-Chrissy/Sam-Mark/Jordie-Jesse,mel mitchelle expendable power core group seems obvious idk everyone see,-1
Sun Feb 20 15:54:16 +0000 2022,SurvivorAU,23374,1199,868,Usa,Very heartbreaking to see Nina leave due to an injury. She was one of the best players this season and she absolutely deserves a second chance. This season will not be the same without her :( #SurvivorAU,heartbreaking see nina leave due injury one best player season absolutely deserves second chance season without,1
Sun Feb 20 15:52:46 +0000 2022,SurvivorAU,13482,660,753,India,"#SurvivorAu, it's about time to tone down the challenges. Your franchise can't afford medevacs and quit given the alloted fixed number of episodes.

Grandeur is great, but not at the cost of losing players https://t.co/4hcpaCIJ5d",time tone challenge franchise afford medevac quit given alloted fixed number episode grandeur great cost losing player,-1
Sun Feb 20 15:48:43 +0000 2022,SurvivorAU,12956,247,324,Australia,"#SurvivorAU is just pissing me off now. Knowing the shit they’re leaving out of the edit, keeping the twins invisible, the fact they consistently spoil who wins challenges or even show certain people wearing merge buffs in confessionals… it’s enough already.",pissing knowing shit leaving edit keeping twin invisible fact consistently spoil win challenge even show certain people wearing merge buff enough already,-1
Sun Feb 20 15:48:15 +0000 2022,SurvivorAU,566,216,832,Australia,"Just watched episode 10 of #survivorAU and I'm heartbroken that Nina went out like that, it was rlly sad, but I'm rlly happy that I saw her play for 10 episodes! I was rlly excited how Jesse wanted to blindside Ben, but because of that stupid twist he didn't, maybe kinda tho lol",watched episode heartbroken nina went like rlly sad rlly happy saw play episode rlly excited jesse wanted blindside ben stupid twist maybe kinda tho lol,1
Sun Feb 20 15:59:52 +0000 2022,SurvivorAU,569,216,832,Australia,"I don't get why they have to throw their buff in the fire?!! it pisses me off, like at least let me keep it as a souvenir  #survivorAU https://t.co/hJMVun89Se",get throw buff fire piss like least let keep souvenir,-1
Sun Feb 20 16:20:53 +0000 2022,SurvivorAU,4261,264,769,Canada,New #Survivor drinking game: Drink every time @SandraDTwine or anyone else refers to her as the queen on #AustralianSurvivor. #SurvivorAU https://t.co/dAbPbwiPOd,new drinking game drink every time anyone else refers queen,0
Sun Feb 20 16:41:43 +0000 2022,SurvivorAU,13606,257,1943,Australia,"Man, Sam and Jesse have been through a lot—from Sophie blindside to Ben.

Jordie was smart; very strategic.

Don't be a power couple, Shay and Ben.

KJ (🥰) and Sophie—shifters haha.

Nina, too early to leave the game.

Rooting for Jesse and KJ! 💪🏼

 #SurvivorAU 🤯",man sam jesse sophie blindside ben jordie smart strategic power couple shay ben haha nina early leave game rooting jesse,0
Sun Feb 20 16:37:57 +0000 2022,SurvivorAU,15914,6007,611,Australia,Spoiler: Nina deserved better to go out like that. Is there even any point to watching now? 😭 #SurvivorAU,spoiler nina deserved better like even point watching,0
Sun Feb 20 16:54:50 +0000 2022,SurvivorAU,8115,658,525,Usa,"The way @samanthagash says, “All the big boys,” on last nights @Survivor_AU is my new walking around vibe. #SurvivorAU",way say big boy last night new walking around vibe,0
Sun Feb 20 16:47:29 +0000 2022,SurvivorAU,81096,4193,607,Usa,#SurvivorAU Ep 10: We need to teach a class in what it means to flush an idol. Hint: It doesn’t mean throwing a couple votes that person’s way when they know they aren’t the target. 🤦🏻‍♂️ This tribe STILL hasn’t figured that out.,need teach class mean flush idol hint mean throwing couple vote person way know target tribe still figured,-1
Sun Feb 20 16:47:29 +0000 2022,SurvivorAU,81096,4193,607,Usa,#SurvivorAU Ep 10: There was SO MUCH talk about Jesse’s plan and Ben being a threat and definitely going that it just added to knowing it would be a non-elimination Tribal. But at least I enjoyed the way it was handled by production.,much talk jesse plan ben threat definitely going added knowing would tribal least enjoyed way handled production,1
